{"schemaVersion":1,"generatedAt":"2026-08-20T12:00:00Z","nextCheckAt":"2026-08-20T12:05:00Z","stale":false,"overallStatus":"operational","summary":{"message":"All monitored services are operating normally.","availability24h":{"percent":99.93,"availableChecks":1439,"eligibleChecks":1440,"scheduledChecks":1440,"maintenanceChecks":0,"monitoringCoveragePercent":100},"activeIncidentCount":0,"incidents24h":1},"components":[{"id":"production-website","name":"Production Website","group":"production","status":"operational","checkedAt":"2026-08-20T12:00:00Z","uptime":{"hours24":100,"days90":100},"history":[{"date":"2026-05-23","status":"unknown","uptimePercent":null,"coveragePercent":0,"sampleCount":0,"maintenanceSampleCount":0},{"date":"2026-05-24","status":"unknown","uptimePercent":null,"coveragePercent":0,"sampleCount":0,"maintenanceSampleCount":0},{"date":"2026-05-25","status":"operational","uptimePercent":100,"coveragePercent":100,"sampleCount":288,"maintenanceSampleCount":0},{"date":"2026-05-26","status":"operational","uptimePercent":100,"coveragePercent":100,"sampleCount":288,"maintenanceSampleCount":0},{"date":"2026-05-27","status":"operational","uptimePercent":100,"coveragePercent":100,"sampleCount":288,"maintenanceSampleCount":0},{"date":"2026-05-28","status":"operational","uptimePercent":100,"coveragePercent":100,"sampleCount":288,"maintenanceSampleCount":0},{"date":"2026-05-29","status":"operational","uptimePercent":100,"coveragePercent":100,"sampleCount":288,"maintenanceSampleCount":0},{"date":"2026-05-30","status":"operational","uptimePercent":100,"coveragePercent":100,"sampleCount":288,"maintenanceSampleCount":0},{"date":"2026-05-31","status":"operational","uptimePercent":100,"coveragePercent":100,"sampleCount":288,"maintenanceSampleCount":0},{"date":"2026-06-01","status":"operational","uptimePercent":100,"coveragePercent":100,"sampleCount":288,"maintenanceSampleCount":0},{"date":"2026-06-02","status":"operational","uptimePercent":100,"coveragePercent":100,"sampleCount":288,"maintenanceSampleCount":0},{"date":"2026-06-03","status":"operational","uptimePercent":100,"coveragePercent":100,"sampleCount":288,"maintenanceSampleCount":0},{"date":"2026-06-04","status":"operational","uptimePercent":100,"coveragePercent":100,"sampleCount":288,"maintenanceSampleCount":0},{"date":"2026-06-05","status":"operational","uptimePercent":100,"coveragePercent":100,"sampleCount":288,"maintenanceSampleCount":0},{"date":"2026-06-06","status":"operational","uptimePercent":100,"coveragePercent":100,"sampleCount":288,"maintenanceSampleCount":0},{"date":"2026-06-07","status":"operational","uptimePercent":100,"coveragePercent":100,"sampleCount":288,"maintenanceSampleCount":0},{"date":"2026-06-08","status":"operational","uptimePercent":100,"coveragePercent":100,"sampleCount":288,"maintenanceSampleCount":0},{"date":"2026-06-09","status":"operational","uptimePercent":100,"coveragePercent":100,"sampleCount":288,"maintenanceSampleCount":0},{"date":"2026-06-10","status":"operational","uptimePercent":100,"coveragePercent":100,"sampleCount":288,"maintenanceSampleCount":0},{"date":"2026-06-11","status":"operational","uptimePercent":100,"coveragePercent":100,"sampleCount":288,"maintenanceSampleCount":0},{"date":"2026-06-12","status":"operational","uptimePercent":100,"coveragePercent":100,"sampleCount":288,"maintenanceSampleCount":0},{"date":"2026-06-13","status":"operational","uptimePercent":100,"coveragePercent":100,"sampleCount":288,"maintenanceSampleCount":0},{"date":"2026-06-14","status":"operational","uptimePercent":100,"coveragePercent":100,"sampleCount":288,"maintenanceSampleCount":0},{"date":"2026-06-15","status":"operational","uptimePercent":100,"coveragePercent":100,"sampleCount":288,"maintenanceSampleCount":0},{"date":"2026-06-16","status":"operational","uptimePercent":100,"coveragePercent":100,"sampleCount":288,"maintenanceSampleCount":0},{"date":"2026-06-17","status":"operational","uptimePercent":100,"coveragePercent":100,"sampleCount":288,"maintenanceSampleCount":0},{"date":"2026-06-18","status":"operational","uptimePercent":100,"coveragePercent":100,"sampleCount":288,"maintenanceSampleCount":0},{"date":"2026-06-19","status":"operational","uptimePercent":100,"coveragePercent":100,"sampleCount":288,"maintenanceSampleCount":0},{"date":"2026-06-20","status":"operational","uptimePercent":100,"coveragePercent":100,"sampleCount":288,"maintenanceSampleCount":0},{"date":"2026-06-21","status":"operational","uptimePercent":100,"coveragePercent":100,"sampleCount":288,"maintenanceSampleCount":0},{"date":"2026-06-22","status":"operational","uptimePercent":100,"coveragePercent":100,"sampleCount":288,"maintenanceSampleCount":0},{"date":"2026-06-23","status":"operational","uptimePercent":100,"coveragePercent":100,"sampleCount":288,"maintenanceSampleCount":0},{"date":"2026-06-24","status":"operational","uptimePercent":100,"coveragePercent":100,"sampleCount":288,"maintenanceSampleCount":0},{"date":"2026-06-25","status":"operational","uptimePercent":100,"coveragePercent":100,"sampleCount":288,"maintenanceSampleCount":0},{"date":"2026-06-26","status":"operational","uptimePercent":100,"coveragePercent":100,"sampleCount":288,"maintenanceSampleCount":0},{"date":"2026-06-27","status":"operational","uptimePercent":100,"coveragePercent":100,"sampleCount":288,"maintenanceSampleCount":0},{"date":"2026-06-28","status":"operational","uptimePercent":100,"coveragePercent":100,"sampleCount":288,"maintenanceSampleCount":0},{"date":"2026-06-29","status":"operational","uptimePercent":100,"coveragePercent":100,"sampleCount":288,"maintenanceSampleCount":0},{"date":"2026-06-30","status":"operational","uptimePercent":100,"coveragePercent":100,"sampleCount":288,"maintenanceSampleCount":0},{"date":"2026-07-01","status":"operational","uptimePercent":100,"coveragePercent":100,"sampleCount":288,"maintenanceSampleCount":0},{"date":"2026-07-02","status":"operational","uptimePercent":100,"coveragePercent":100,"sampleCount":288,"maintenanceSampleCount":0},{"date":"2026-07-03","status":"operational","uptimePercent":100,"coveragePercent":100,"sampleCount":288,"maintenanceSampleCount":0},{"date":"2026-07-04","status":"operational","uptimePercent":100,"coveragePercent":100,"sampleCount":288,"maintenanceSampleCount":0},{"date":"2026-07-05","status":"operational","uptimePercent":100,"coveragePercent":100,"sampleCount":288,"maintenanceSampleCount":0},{"date":"2026-07-06","status":"operational","uptimePercent":100,"coveragePercent":100,"sampleCount":288,"maintenanceSampleCount":0},{"date":"2026-07-07","status":"operational","uptimePercent":100,"coveragePercent":100,"sampleCount":288,"maintenanceSampleCount":0},{"date":"2026-07-08","status":"operational","uptimePercent":100,"coveragePercent":100,"sampleCount":288,"maintenanceSampleCount":0},{"date":"2026-07-09","status":"operational","uptimePercent":100,"coveragePercent":100,"sampleCount":288,"maintenanceSampleCount":0},{"date":"2026-07-10","status":"operational","uptimePercent":100,"coveragePercent":100,"sampleCount":288,"maintenanceSampleCount":0},{"date":"2026-07-11","status":"operational","uptimePercent":100,"coveragePercent":100,"sampleCount":288,"maintenanceSampleCount":0},{"date":"2026-07-12","status":"operational","uptimePercent":100,"coveragePercent":100,"sampleCount":288,"maintenanceSampleCount":0},{"date":"2026-07-13","status":"operational","uptimePercent":100,"coveragePercent":100,"sampleCount":288,"maintenanceSampleCount":0},{"date":"2026-07-14","status":"operational","uptimePercent":100,"coveragePercent":100,"sampleCount":288,"maintenanceSampleCount":0},{"date":"2026-07-15","status":"operational","uptimePercent":100,"coveragePercent":100,"sampleCount":288,"maintenanceSampleCount":0},{"date":"2026-07-16","status":"operational","uptimePercent":100,"coveragePercent":100,"sampleCount":288,"maintenanceSampleCount":0},{"date":"2026-07-17","status":"operational","uptimePercent":100,"coveragePercent":100,"sampleCount":288,"maintenanceSampleCount":0},{"date":"2026-07-18","status":"operational","uptimePercent":100,"coveragePercent":100,"sampleCount":288,"maintenanceSampleCount":0},{"date":"2026-07-19","status":"operational","uptimePercent":100,"coveragePercent":100,"sampleCount":288,"maintenanceSampleCount":0},{"date":"2026-07-20","status":"operational","uptimePercent":100,"coveragePercent":100,"sampleCount":288,"maintenanceSampleCount":0},{"date":"2026-07-21","status":"operational","uptimePercent":100,"coveragePercent":100,"sampleCount":288,"maintenanceSampleCount":0},{"date":"2026-07-22","status":"operational","uptimePercent":100,"coveragePercent":100,"sampleCount":288,"maintenanceSampleCount":0},{"date":"2026-07-23","status":"operational","uptimePercent":100,"coveragePercent":100,"sampleCount":288,"maintenanceSampleCount":0},{"date":"2026-07-24","status":"operational","uptimePercent":100,"coveragePercent":100,"sampleCount":288,"maintenanceSampleCount":0},{"date":"2026-07-25","status":"operational","uptimePercent":100,"coveragePercent":100,"sampleCount":288,"maintenanceSampleCount":0},{"date":"2026-07-26","status":"operational","uptimePercent":100,"coveragePercent":100,"sampleCount":288,"maintenanceSampleCount":0},{"date":"2026-07-27","status":"operational","uptimePercent":100,"coveragePercent":100,"sampleCount":288,"maintenanceSampleCount":0},{"date":"2026-07-28","status":"operational","uptimePercent":100,"coveragePercent":100,"sampleCount":288,"maintenanceSampleCount":0},{"date":"2026-07-29","status":"operational","uptimePercent":100,"coveragePercent":100,"sampleCount":288,"maintenanceSampleCount":0},{"date":"2026-07-30","status":"operational","uptimePercent":100,"coveragePercent":100,"sampleCount":288,"maintenanceSampleCount":0},{"date":"2026-07-31","status":"operational","uptimePercent":100,"coveragePercent":100,"sampleCount":288,"maintenanceSampleCount":0},{"date":"2026-08-01","status":"maintenance","uptimePercent":null,"coveragePercent":100,"sampleCount":288,"maintenanceSampleCount":288},{"date":"2026-08-02","status":"oper